{
  "ok": true,
  "reviewId": "01JAC7Q2HV5M8N3P4R6S9T0W1X",
  "pmPreviewUrl": null,
  "clientPreviewUrl": "https://oasispoolspas.com/_emdash/api/plugins/agency-os-bridge/review?t=a7c9e1f3b5d7092a4c6e8f1b3d5f7a9c1e3b5d7f9a2c4e6b8d0f1a3c5e7b9d1f",
  "expiresAt": {
    "pm": null,
    "client": "2026-10-29T12:00:00Z"
  }
}
